{
  "benchmark_id": "001_synthetic_mine_throughput",
  "scenarios": {
    "trucks_12": {
      "replications": 30,
      "shift_length_hours": 8,
      "total_tonnes_mean": 12900.0,
      "total_tonnes_ci95_low": 12900.0,
      "total_tonnes_ci95_high": 12900.0,
      "tonnes_per_hour_mean": 1612.5,
      "tonnes_per_hour_ci95_low": 1612.5,
      "tonnes_per_hour_ci95_high": 1612.5,
      "average_cycle_time_min": 0,
      "truck_utilisation_mean": 0,
      "loader_utilisation": {
        "LOAD_N": 0.676521292705179,
        "LOAD_S": 0.8278665579216894
      },
      "crusher_utilisation": 0.9239763496919539,
      "average_loader_queue_time_min": 4.092841838836067,
      "average_crusher_queue_time_min": 15.424027594694678,
      "top_bottlenecks": []
    },
    "crusher_slowdown": {
      "replications": 30,
      "shift_length_hours": 8,
      "total_tonnes_mean": 6600.0,
      "total_tonnes_ci95_low": 6600.0,
      "total_tonnes_ci95_high": 6600.0,
      "tonnes_per_hour_mean": 825.0,
      "tonnes_per_hour_ci95_low": 825.0,
      "tonnes_per_hour_ci95_high": 825.0,
      "average_cycle_time_min": 0,
      "truck_utilisation_mean": 0,
      "loader_utilisation": {
        "LOAD_N": 0.1270605289435533,
        "LOAD_S": 0.5758300255724323
      },
      "crusher_utilisation": 0.9501807398948487,
      "average_loader_queue_time_min": 1.7074317996483872,
      "average_crusher_queue_time_min": 28.44758047182242,
      "top_bottlenecks": []
    },
    "ramp_closed": {
      "replications": 30,
      "shift_length_hours": 8,
      "total_tonnes_mean": 12900.0,
      "total_tonnes_ci95_low": 12900.0,
      "total_tonnes_ci95_high": 12900.0,
      "tonnes_per_hour_mean": 1612.5,
      "tonnes_per_hour_ci95_low": 1612.5,
      "tonnes_per_hour_ci95_high": 1612.5,
      "average_cycle_time_min": 0,
      "truck_utilisation_mean": 0,
      "loader_utilisation": {
        "LOAD_N": 0.6158757436207333,
        "LOAD_S": 0.7938105832411172
      },
      "crusher_utilisation": 0.910901433297047,
      "average_loader_queue_time_min": 2.5126177654266257,
      "average_crusher_queue_time_min": 4.269105889233453,
      "top_bottlenecks": []
    },
    "ramp_upgrade": {
      "replications": 30,
      "shift_length_hours": 8,
      "total_tonnes_mean": 13000.0,
      "total_tonnes_ci95_low": 13000.0,
      "total_tonnes_ci95_high": 13000.0,
      "tonnes_per_hour_mean": 1625.0,
      "tonnes_per_hour_ci95_low": 1625.0,
      "tonnes_per_hour_ci95_high": 1625.0,
      "average_cycle_time_min": 0,
      "truck_utilisation_mean": 0,
      "loader_utilisation": {
        "LOAD_N": 0.6522971591211841,
        "LOAD_S": 0.7751172481201245
      },
      "crusher_utilisation": 0.9163266748197475,
      "average_loader_queue_time_min": 2.2833291822364816,
      "average_crusher_queue_time_min": 4.252060101465955,
      "top_bottlenecks": []
    },
    "baseline": {
      "replications": 30,
      "shift_length_hours": 8,
      "total_tonnes_mean": 12900.0,
      "total_tonnes_ci95_low": 12900.0,
      "total_tonnes_ci95_high": 12900.0,
      "tonnes_per_hour_mean": 1612.5,
      "tonnes_per_hour_ci95_low": 1612.5,
      "tonnes_per_hour_ci95_high": 1612.5,
      "average_cycle_time_min": 0,
      "truck_utilisation_mean": 0,
      "loader_utilisation": {
        "LOAD_N": 0.6158757436207333,
        "LOAD_S": 0.7938105832411172
      },
      "crusher_utilisation": 0.910901433297047,
      "average_loader_queue_time_min": 2.5126177654266257,
      "average_crusher_queue_time_min": 4.269105889233453,
      "top_bottlenecks": []
    },
    "trucks_4": {
      "replications": 30,
      "shift_length_hours": 8,
      "total_tonnes_mean": 8600.0,
      "total_tonnes_ci95_low": 8600.0,
      "total_tonnes_ci95_high": 8600.0,
      "tonnes_per_hour_mean": 1075.0,
      "tonnes_per_hour_ci95_low": 1075.0,
      "tonnes_per_hour_ci95_high": 1075.0,
      "average_cycle_time_min": 0,
      "truck_utilisation_mean": 0,
      "loader_utilisation": {
        "LOAD_N": 0.15566966874230426,
        "LOAD_S": 0.7059324878855002
      },
      "crusher_utilisation": 0.6390830007671819,
      "average_loader_queue_time_min": 1.0145844066158982,
      "average_crusher_queue_time_min": 0.36333401942962745,
      "top_bottlenecks": []
    }
  },
  "key_assumptions": [
    "Constant truck payload",
    "Instantaneous dispatch routing"
  ],
  "model_limitations": [
    "No shift change/breaks modelled"
  ],
  "additional_scenarios_proposed": []
}